number,value,datetime_start,datetime_complete,duration,params_batch_size,params_channels,params_dropout,params_lr,params_weight_decay,state
0,0.9986412943148506,2026-10-01 16:09:24.473393,2026-10-01 16:10:07.713668,0 days 00:00:43.240275,16,small,0.4330880728874676,0.0003574712922600243,0.00025378155082656634,COMPLETE
1,0.9972825284300695,2026-10-01 16:10:07.741335,2026-10-01 16:10:40.937952,0 days 00:00:33.196617,32,small,0.15212112147976886,0.0011114989443094978,0.0001256104370001356,COMPLETE
2,0.9932203419083492,2026-10-01 16:10:40.957403,2026-10-01 16:12:25.447588,0 days 00:01:44.490185,32,large,0.3925879806965068,0.0004345454109729479,6.290644294586145e-06,COMPLETE
3,0.9959238526811498,2026-10-01 16:12:25.465949,2026-10-01 16:14:11.866533,0 days 00:01:46.400584,64,large,0.4828160165372797,0.0005748924681991981,0.0017123375973163992,COMPLETE
4,0.9864562301886987,2026-10-01 16:14:11.886075,2026-10-01 16:14:50.312955,0 days 00:00:38.426880,32,medium,0.45466020103939103,0.00028180680291847244,1.0842262717330169e-05,PRUNED
5,0.6526571639615899,2026-10-01 16:14:50.329514,2026-10-01 16:15:14.081501,0 days 00:00:23.751987,64,medium,0.46974947078209456,0.0009519754482692679,0.003795853142670641,PRUNED
6,0.9644705617955805,2026-10-01 16:15:14.099311,2026-10-01 16:16:08.188474,0 days 00:00:54.089163,16,large,0.13567451588694796,0.0007641361869233315,0.0020651425578959264,PRUNED
7,0.9740192793717598,2026-10-01 16:16:08.209171,2026-10-01 16:17:00.918051,0 days 00:00:52.708880,32,large,0.3861223846483287,0.0003364867144187955,6.235377135673162e-06,PRUNED
8,0.9633177092310928,2026-10-01 16:17:00.937891,2026-10-01 16:17:14.830850,0 days 00:00:13.892959,16,small,0.05793452976256486,0.0001018959297939515,0.0028340904295147754,PRUNED
9,0.9836910380483621,2026-10-01 16:17:14.850343,2026-10-01 16:17:55.509123,0 days 00:00:40.658780,16,medium,0.44360637128816327,0.0008330803890301997,7.742116473996259e-05,PRUNED
10,0.9336011556990179,2026-10-01 16:17:55.528006,2026-10-01 16:18:09.611642,0 days 00:00:14.083636,16,small,0.2765046693392435,0.0025440689959558673,1.3742994691463978e-06,PRUNED
11,0.9945725016569704,2026-10-01 16:18:09.628168,2026-10-01 16:18:43.508933,0 days 00:00:33.880765,32,small,0.24222642342696374,0.0019314161597628172,0.00018678344058775705,PRUNED
12,0.9932203419083492,2026-10-01 16:18:43.530510,2026-10-01 16:19:16.687703,0 days 00:00:33.157193,16,small,0.24944065171985527,0.00017710046676710868,0.0002641304593185871,PRUNED
13,0.9972862508284852,2026-10-01 16:19:16.709316,2026-10-01 16:19:49.976671,0 days 00:00:33.267355,32,small,0.012785188844602557,0.0014227107630832455,5.967358260854917e-05,COMPLETE
14,0.9932278788265565,2026-10-01 16:19:49.996067,2026-10-01 16:20:19.890784,0 days 00:00:29.894717,64,small,0.043184460909635236,0.0015452528576414598,2.457727460796525e-05,PRUNED
